[
  {
    "id": "exp_botox_pre_1",
    "serviceId": "svc_botox",
    "phase": "pre",
    "textKey": "exp.botox.pre.1"
  },
  {
    "id": "exp_botox_pre_2",
    "serviceId": "svc_botox",
    "phase": "pre",
    "textKey": "exp.botox.pre.2"
  },
  {
    "id": "exp_botox_pre_3",
    "serviceId": "svc_botox",
    "phase": "pre",
    "textKey": "exp.botox.pre.3"
  },
  {
    "id": "exp_botox_during_1",
    "serviceId": "svc_botox",
    "phase": "during",
    "textKey": "exp.botox.during.1"
  },
  {
    "id": "exp_botox_during_2",
    "serviceId": "svc_botox",
    "phase": "during",
    "textKey": "exp.botox.during.2"
  },
  {
    "id": "exp_botox_post_1",
    "serviceId": "svc_botox",
    "phase": "post",
    "textKey": "exp.botox.post.1"
  },
  {
    "id": "exp_botox_post_2",
    "serviceId": "svc_botox",
    "phase": "post",
    "textKey": "exp.botox.post.2"
  },
  {
    "id": "exp_botox_post_3",
    "serviceId": "svc_botox",
    "phase": "post",
    "textKey": "exp.botox.post.3"
  },
  {
    "id": "exp_botox_post_4",
    "serviceId": "svc_botox",
    "phase": "post",
    "textKey": "exp.botox.post.4"
  },
  {
    "id": "exp_botox_post_5",
    "serviceId": "svc_botox",
    "phase": "post",
    "textKey": "exp.botox.post.5"
  },
  {
    "id": "exp_dermawrinkle_pre_1",
    "serviceId": "svc_dermawrinkle",
    "phase": "pre",
    "textKey": "exp.dermawrinkle.pre.1"
  },
  {
    "id": "exp_dermawrinkle_pre_2",
    "serviceId": "svc_dermawrinkle",
    "phase": "pre",
    "textKey": "exp.dermawrinkle.pre.2"
  },
  {
    "id": "exp_dermawrinkle_pre_3",
    "serviceId": "svc_dermawrinkle",
    "phase": "pre",
    "textKey": "exp.dermawrinkle.pre.3"
  },
  {
    "id": "exp_dermawrinkle_during_1",
    "serviceId": "svc_dermawrinkle",
    "phase": "during",
    "textKey": "exp.dermawrinkle.during.1"
  },
  {
    "id": "exp_dermawrinkle_during_2",
    "serviceId": "svc_dermawrinkle",
    "phase": "during",
    "textKey": "exp.dermawrinkle.during.2"
  },
  {
    "id": "exp_dermawrinkle_post_1",
    "serviceId": "svc_dermawrinkle",
    "phase": "post",
    "textKey": "exp.dermawrinkle.post.1"
  },
  {
    "id": "exp_dermawrinkle_post_2",
    "serviceId": "svc_dermawrinkle",
    "phase": "post",
    "textKey": "exp.dermawrinkle.post.2"
  },
  {
    "id": "exp_dermawrinkle_post_3",
    "serviceId": "svc_dermawrinkle",
    "phase": "post",
    "textKey": "exp.dermawrinkle.post.3"
  },
  {
    "id": "exp_dermawrinkle_post_4",
    "serviceId": "svc_dermawrinkle",
    "phase": "post",
    "textKey": "exp.dermawrinkle.post.4"
  },
  {
    "id": "exp_dermawrinkle_post_5",
    "serviceId": "svc_dermawrinkle",
    "phase": "post",
    "textKey": "exp.dermawrinkle.post.5"
  }
]
